{"$schema":"https://json-schema.org/draft/2020-12/schema","type":"object","additionalProperties":false,"required":["schema_version","request_id","requested_action","actor_id","actor_authority","requested_at","sku_id","product_version","current_passport","source_inventory","idempotency_key"],"properties":{"schema_version":{"const":"1.0"},"request_id":{"type":"string","pattern":"^LS-PSP-REQ-[A-Z0-9._-]+$"},"requested_action":{"enum":["SUBMIT_SOURCE_EVIDENCE_DELTA","RECREATE_PASSPORT"]},"actor_id":{"type":"string","minLength":1},"actor_authority":{"enum":["PRODUCT_OWNER","DATA_CONTRIBUTOR","PASSPORT_ADMIN","PRODUCT_OWNER_WITH_RECREATE_AUTHORITY"]},"requested_at":{"type":"string","format":"date-time"},"sku_id":{"type":"string","minLength":1},"product_version":{"type":"string","minLength":1},"current_passport":{"$ref":"#/$defs/passport"},"source_inventory":{"type":"array","minItems":1,"items":{"$ref":"#/$defs/source"}},"scope":{"type":["string","null"]},"user_context":{"type":["string","null"]},"recreate_reason":{"type":["string","null"]},"confirmations":{"type":"array","maxItems":2,"items":{"$ref":"#/$defs/confirmation"}},"idempotency_key":{"type":"string","minLength":16}},"allOf":[{"if":{"properties":{"requested_action":{"const":"RECREATE_PASSPORT"}},"required":["requested_action"]},"then":{"properties":{"actor_authority":{"enum":["PASSPORT_ADMIN","PRODUCT_OWNER_WITH_RECREATE_AUTHORITY"]},"confirmations":{"minItems":2,"maxItems":2,"allOf":[{"contains":{"properties":{"confirmation_type":{"const":"RECREATE_INTENT_CONFIRMED"}},"required":["confirmation_type"]},"minContains":1,"maxContains":1},{"contains":{"properties":{"confirmation_type":{"const":"RECREATE_SNAPSHOT_CONFIRMED"}},"required":["confirmation_type"]},"minContains":1,"maxContains":1}]},"recreate_reason":{"type":"string","minLength":1}},"required":["confirmations","recreate_reason"]}}],"$defs":{"sha":{"type":"string","pattern":"^[a-f0-9]{64}$"},"passport":{"type":"object","additionalProperties":false,"required":["passport_id","passport_lineage_id","version","path","sha256"],"properties":{"passport_id":{"type":"string","minLength":1},"passport_lineage_id":{"type":"string","minLength":1},"version":{"type":"string","minLength":1},"path":{"type":"string","minLength":1},"sha256":{"$ref":"#/$defs/sha"}}},"source":{"type":"object","additionalProperties":false,"required":["source_artifact_id","type","original_locator","archived_locator","sha256","access_result"],"properties":{"source_artifact_id":{"type":"string","minLength":1},"type":{"type":"string","minLength":1},"original_locator":{"type":"string","minLength":1},"archived_locator":{"type":"string","minLength":1},"sha256":{"$ref":"#/$defs/sha"},"access_result":{"enum":["ACCEPTED","ACCESS_DENIED","UNAVAILABLE","UNSUPPORTED","DUPLICATE_EXACT"]},"duplicate_of":{"type":["string","null"]}}},"confirmation":{"type":"object","additionalProperties":false,"required":["confirmation_id","recreate_request_id","confirmation_type","actor_id","confirmed_at","passport_version","passport_sha256"],"properties":{"confirmation_id":{"type":"string","minLength":1},"recreate_request_id":{"type":"string","minLength":1},"confirmation_type":{"enum":["RECREATE_INTENT_CONFIRMED","RECREATE_SNAPSHOT_CONFIRMED"]},"actor_id":{"type":"string","minLength":1},"confirmed_at":{"type":"string","format":"date-time"},"passport_version":{"type":"string","minLength":1},"passport_sha256":{"$ref":"#/$defs/sha"}}}}}
