{
  "schema_version": "1.0",
  "request_id": "LS-PSP-REQ-FIXTURE-DELTA-001",
  "requested_action": "SUBMIT_SOURCE_EVIDENCE_DELTA",
  "actor_id": "USER-FIXTURE-001",
  "actor_authority": "DATA_CONTRIBUTOR",
  "requested_at": "2026-10-04T12:00:00Z",
  "sku_id": "SKU-FIXTURE-001",
  "product_version": "V1",
  "current_passport": {
    "passport_id": "PSP-FIXTURE-001",
    "passport_lineage_id": "LINEAGE-FIXTURE-001",
    "version": "7",
    "path": "C:/product/SKU-FIXTURE-001/passport.json",
    "sha256": "aaaaaaaaaaaaaaaaaaaaaaaaaaaaaaaaaaaaaaaaaaaaaaaaaaaaaaaaaaaaaaaa"
  },
  "source_inventory": [
    {
      "source_artifact_id": "SRC-FIXTURE-001",
      "type": "PDF",
      "original_locator": "C:/input/manual.pdf",
      "archived_locator": "C:/product/SKU-FIXTURE-001/артефакти/2026-10-04/manual.pdf",
      "sha256": "bbbbbbbbbbbbbbbbbbbbbbbbbbbbbbbbbbbbbbbbbbbbbbbbbbbbbbbbbbbbbbbb",
      "access_result": "ACCEPTED",
      "duplicate_of": null
    }
  ],
  "scope": "new product evidence",
  "user_context": "Supplier manual provided by product owner",
  "recreate_reason": null,
  "confirmations": [],
  "idempotency_key": "FIXTURE-DELTA-IDEMPOTENCY-0001"
}
